{"abi_version":1,"bounds":{"max_components":4096,"max_episode_input_bytes":67108864,"max_hyperedges":32768,"max_hyperedges_per_episode":128,"max_labels":32768,"max_labels_per_episode":128,"max_members_per_record":4096,"max_partition_artifact_bytes":134217728,"max_solver_key_ints":128,"max_solver_memory_bytes":201326592,"max_solver_seconds":120,"max_solver_states":250000,"max_source_episodes":4096,"max_total_hyperedge_memberships":131072,"max_total_label_memberships":131072},"config_ref":"r4_partition_config_v1:0647f2402b0b942044c243ec","feasibility_basis_ref":"r4_partition_feasibility_basis_v1:8d7b96e61cd31e98bbc9de46","maxima":[{"dimension_ref":"r4_stratification_label_v3:03544335b52b480975f51eb9","maximum":393,"split":"train"},{"dimension_ref":"r4_stratification_label_v3:03544335b52b480975f51eb9","maximum":393,"split":"selection"},{"dimension_ref":"r4_stratification_label_v3:03544335b52b480975f51eb9","maximum":393,"split":"calibration"},{"dimension_ref":"r4_stratification_label_v3:03544335b52b480975f51eb9","maximum":393,"split":"frozen_test"},{"dimension_ref":"r4_stratification_label_v3:07dddab6f7d2db7853aae284","maximum":44,"split":"train"},{"dimension_ref":"r4_stratification_label_v3:07dddab6f7d2db7853aae284","maximum":44,"split":"selection"},{"dimension_ref":"r4_stratification_label_v3:07dddab6f7d2db7853aae284","maximum":44,"split":"calibration"},{"dimension_ref":"r4_stratification_label_v3:07dddab6f7d2db7853aae284","maximum":44,"split":"frozen_test"},{"dimension_ref":"r4_stratification_label_v3:09c607ed152c138ceefcdf0d","maximum":400,"split":"train"},{"dimension_ref":"r4_stratification_label_v3:09c607ed152c138ceefcdf0d","maximum":400,"split":"selection"},{"dimension_ref":"r4_stratification_label_v3:09c607ed152c138ceefcdf0d","maximum":400,"split":"calibration"},{"dimension_ref":"r4_stratification_label_v3:09c607ed152c138ceefcdf0d","maximum":400,"split":"frozen_test"},{"dimension_ref":"r4_stratification_label_v3:09e2e4d185583c17b9c4abc6","maximum":20,"split":"train"},{"dimension_ref":"r4_stratification_label_v3:09e2e4d185583c17b9c4abc6","maximum":20,"split":"selection"},{"dimension_ref":"r4_stratification_label_v3:09e2e4d185583c17b9c4abc6","maximum":20,"split":"calibration"},{"dimension_ref":"r4_stratification_label_v3:09e2e4d185583c17b9c4abc6","maximum":20,"split":"frozen_test"},{"dimension_ref":"r4_stratification_label_v3:2143682db83348839349b796","maximum":310,"split":"train"},{"dimension_ref":"r4_stratification_label_v3:2143682db83348839349b796","maximum":310,"split":"selection"},{"dimension_ref":"r4_stratification_label_v3:2143682db83348839349b796","maximum":310,"split":"calibration"},{"dimension_ref":"r4_stratification_label_v3:2143682db83348839349b796","maximum":310,"split":"frozen_test"},{"dimension_ref":"r4_stratification_label_v3:265a42a4b3fa35ccb44236d8","maximum":168,"split":"train"},{"dimension_ref":"r4_stratification_label_v3:265a42a4b3fa35ccb44236d8","maximum":168,"split":"selection"},{"dimension_ref":"r4_stratification_label_v3:265a42a4b3fa35ccb44236d8","maximum":168,"split":"calibration"},{"dimension_ref":"r4_stratification_label_v3:265a42a4b3fa35ccb44236d8","maximum":168,"split":"frozen_test"},{"dimension_ref":"r4_stratification_label_v3:29f15e383a9560d56d56ff81","maximum":20,"split":"train"},{"dimension_ref":"r4_stratification_label_v3:29f15e383a9560d56d56ff81","maximum":20,"split":"selection"},{"dimension_ref":"r4_stratification_label_v3:29f15e383a9560d56d56ff81","maximum":20,"split":"calibration"},{"dimension_ref":"r4_stratification_label_v3:29f15e383a9560d56d56ff81","maximum":20,"split":"frozen_test"},{"dimension_ref":"r4_stratification_label_v3:2ddf5900a950fb4880a227c9","maximum":400,"split":"train"},{"dimension_ref":"r4_stratification_label_v3:2ddf5900a950fb4880a227c9","maximum":400,"split":"selection"},{"dimension_ref":"r4_stratification_label_v3:2ddf5900a950fb4880a227c9","maximum":400,"split":"calibration"},{"dimension_ref":"r4_stratification_label_v3:2ddf5900a950fb4880a227c9","maximum":400,"split":"frozen_test"},{"dimension_ref":"r4_stratification_label_v3:3617837c25dc1a49996f42da","maximum":132,"split":"train"},{"dimension_ref":"r4_stratification_label_v3:3617837c25dc1a49996f42da","maximum":132,"split":"selection"},{"dimension_ref":"r4_stratification_label_v3:3617837c25dc1a49996f42da","maximum":132,"split":"calibration"},{"dimension_ref":"r4_stratification_label_v3:3617837c25dc1a49996f42da","maximum":132,"split":"frozen_test"},{"dimension_ref":"r4_stratification_label_v3:3fd7214c3f7e65e13d9179db","maximum":268,"split":"train"},{"dimension_ref":"r4_stratification_label_v3:3fd7214c3f7e65e13d9179db","maximum":268,"split":"selection"},{"dimension_ref":"r4_stratification_label_v3:3fd7214c3f7e65e13d9179db","maximum":268,"split":"calibration"},{"dimension_ref":"r4_stratification_label_v3:3fd7214c3f7e65e13d9179db","maximum":268,"split":"frozen_test"},{"dimension_ref":"r4_stratification_label_v3:426ce919d0b74b7e9eed7f69","maximum":132,"split":"train"},{"dimension_ref":"r4_stratification_label_v3:426ce919d0b74b7e9eed7f69","maximum":132,"split":"selection"},{"dimension_ref":"r4_stratification_label_v3:426ce919d0b74b7e9eed7f69","maximum":132,"split":"calibration"},{"dimension_ref":"r4_stratification_label_v3:426ce919d0b74b7e9eed7f69","maximum":132,"split":"frozen_test"},{"dimension_ref":"r4_stratification_label_v3:569de30b7af97443afb56a44","maximum":131,"split":"train"},{"dimension_ref":"r4_stratification_label_v3:569de30b7af97443afb56a44","maximum":131,"split":"selection"},{"dimension_ref":"r4_stratification_label_v3:569de30b7af97443afb56a44","maximum":131,"split":"calibration"},{"dimension_ref":"r4_stratification_label_v3:569de30b7af97443afb56a44","maximum":131,"split":"frozen_test"},{"dimension_ref":"r4_stratification_label_v3:5b14cc4156d8627a8e0cfc1b","maximum":132,"split":"train"},{"dimension_ref":"r4_stratification_label_v3:5b14cc4156d8627a8e0cfc1b","maximum":132,"split":"selection"},{"dimension_ref":"r4_stratification_label_v3:5b14cc4156d8627a8e0cfc1b","maximum":132,"split":"calibration"},{"dimension_ref":"r4_stratification_label_v3:5b14cc4156d8627a8e0cfc1b","maximum":132,"split":"frozen_test"},{"dimension_ref":"r4_stratification_label_v3:5d85d9fee641278ddec74d31","maximum":400,"split":"train"},{"dimension_ref":"r4_stratification_label_v3:5d85d9fee641278ddec74d31","maximum":400,"split":"selection"},{"dimension_ref":"r4_stratification_label_v3:5d85d9fee641278ddec74d31","maximum":400,"split":"calibration"},{"dimension_ref":"r4_stratification_label_v3:5d85d9fee641278ddec74d31","maximum":400,"split":"frozen_test"},{"dimension_ref":"r4_stratification_label_v3:832aaad77db15c44725e30be","maximum":152,"split":"train"},{"dimension_ref":"r4_stratification_label_v3:832aaad77db15c44725e30be","maximum":152,"split":"selection"},{"dimension_ref":"r4_stratification_label_v3:832aaad77db15c44725e30be","maximum":152,"split":"calibration"},{"dimension_ref":"r4_stratification_label_v3:832aaad77db15c44725e30be","maximum":152,"split":"frozen_test"},{"dimension_ref":"r4_stratification_label_v3:8f6d643350f4075b6da33ea6","maximum":152,"split":"train"},{"dimension_ref":"r4_stratification_label_v3:8f6d643350f4075b6da33ea6","maximum":152,"split":"selection"},{"dimension_ref":"r4_stratification_label_v3:8f6d643350f4075b6da33ea6","maximum":152,"split":"calibration"},{"dimension_ref":"r4_stratification_label_v3:8f6d643350f4075b6da33ea6","maximum":152,"split":"frozen_test"},{"dimension_ref":"r4_stratification_label_v3:c44bc219e733b94802be1c54","maximum":131,"split":"train"},{"dimension_ref":"r4_stratification_label_v3:c44bc219e733b94802be1c54","maximum":131,"split":"selection"},{"dimension_ref":"r4_stratification_label_v3:c44bc219e733b94802be1c54","maximum":131,"split":"calibration"},{"dimension_ref":"r4_stratification_label_v3:c44bc219e733b94802be1c54","maximum":131,"split":"frozen_test"},{"dimension_ref":"r4_stratification_label_v3:cc05710ae4a6977cffdb0bc0","maximum":400,"split":"train"},{"dimension_ref":"r4_stratification_label_v3:cc05710ae4a6977cffdb0bc0","maximum":400,"split":"selection"},{"dimension_ref":"r4_stratification_label_v3:cc05710ae4a6977cffdb0bc0","maximum":400,"split":"calibration"},{"dimension_ref":"r4_stratification_label_v3:cc05710ae4a6977cffdb0bc0","maximum":400,"split":"frozen_test"},{"dimension_ref":"r4_stratification_label_v3:cdd344abf1056d05aa46e0b2","maximum":152,"split":"train"},{"dimension_ref":"r4_stratification_label_v3:cdd344abf1056d05aa46e0b2","maximum":152,"split":"selection"},{"dimension_ref":"r4_stratification_label_v3:cdd344abf1056d05aa46e0b2","maximum":152,"split":"calibration"},{"dimension_ref":"r4_stratification_label_v3:cdd344abf1056d05aa46e0b2","maximum":152,"split":"frozen_test"},{"dimension_ref":"r4_stratification_label_v3:d252b798b9d3fa26efaafb6b","maximum":56,"split":"train"},{"dimension_ref":"r4_stratification_label_v3:d252b798b9d3fa26efaafb6b","maximum":56,"split":"selection"},{"dimension_ref":"r4_stratification_label_v3:d252b798b9d3fa26efaafb6b","maximum":56,"split":"calibration"},{"dimension_ref":"r4_stratification_label_v3:d252b798b9d3fa26efaafb6b","maximum":56,"split":"frozen_test"},{"dimension_ref":"r4_stratification_label_v3:de9b33f382b312d7d44c89fa","maximum":363,"split":"train"},{"dimension_ref":"r4_stratification_label_v3:de9b33f382b312d7d44c89fa","maximum":363,"split":"selection"},{"dimension_ref":"r4_stratification_label_v3:de9b33f382b312d7d44c89fa","maximum":363,"split":"calibration"},{"dimension_ref":"r4_stratification_label_v3:de9b33f382b312d7d44c89fa","maximum":363,"split":"frozen_test"},{"dimension_ref":"r4_stratification_label_v3:f9f69549b2637c5c8ee26d00","maximum":112,"split":"train"},{"dimension_ref":"r4_stratification_label_v3:f9f69549b2637c5c8ee26d00","maximum":112,"split":"selection"},{"dimension_ref":"r4_stratification_label_v3:f9f69549b2637c5c8ee26d00","maximum":112,"split":"calibration"},{"dimension_ref":"r4_stratification_label_v3:f9f69549b2637c5c8ee26d00","maximum":112,"split":"frozen_test"}],"minima":[{"dimension_ref":"r4_stratification_labe